{
  "id": "com.anthropic.fetch",
  "name": "Fetch",
  "alias": "fetch",
  "description": "Fetch and extract content from web URLs. Retrieves web pages and converts them to markdown or plain text, enabling AI assistants to read and analyze web content including articles, documentation, and API responses.",
  "icon": "üåê",
  "schema_version": "2.1",
  "transport": {
    "type": "stdio",
    "command": "npx",
    "args": [
      "-y",
      "@modelcontextprotocol/server-fetch"
    ],
    "metadata": {
      "inputs": []
    }
  },
  "auth": {
    "type": "none",
    "instructions": "No authentication required. The server fetches publicly accessible web content."
  },
  "categories": [
    "search",
    "developer-tools"
  ],
  "tags": [
    "fetch",
    "web",
    "http",
    "url",
    "markdown",
    "content-extraction",
    "scraping"
  ],
  "publisher": {
    "name": "Anthropic",
    "domain": "anthropic.com",
    "url": "https://anthropic.com",
    "verified": true,
    "domain_verified": true,
    "official": true
  },
  "links": {
    "repository": "https://github.com/modelcontextprotocol/servers/tree/main/src/fetch",
    "homepage": "https://modelcontextprotocol.io",
    "documentation": "https://github.com/modelcontextprotocol/servers/blob/main/src/fetch/README.md"
  },
  "platforms": [
    "all"
  ],
  "capabilities": {
    "tools": true,
    "resources": false,
    "prompts": false,
    "read_only_mode": true
  },
  "badges": [
    "official"
  ],
  "hosting_type": "local",
  "license": "MIT",
  "license_url": "https://github.com/modelcontextprotocol/servers/blob/main/LICENSE",
  "installation": {
    "difficulty": "easy",
    "prerequisites": [
      "Node.js 18+"
    ],
    "estimated_time": "2 minutes"
  }
}
