{
  "id": "com.anthropic.puppeteer",
  "name": "Puppeteer",
  "alias": "puppeteer",
  "description": "Automate browser interactions using Puppeteer. Navigate web pages, take screenshots, click elements, fill forms, and execute JavaScript in a headless or headed Chromium browser instance.",
  "icon": "ðŸŽ­",
  "schema_version": "2.1",
  "transport": {
    "type": "stdio",
    "command": "npx",
    "args": [
      "-y",
      "@modelcontextprotocol/server-puppeteer"
    ],
    "metadata": {
      "inputs": []
    }
  },
  "auth": {
    "type": "none",
    "instructions": "No authentication required. Puppeteer runs a local browser instance."
  },
  "categories": [
    "developer-tools",
    "search"
  ],
  "tags": [
    "browser",
    "puppeteer",
    "automation",
    "web-scraping",
    "screenshots",
    "headless",
    "testing",
    "chromium"
  ],
  "publisher": {
    "name": "Anthropic",
    "domain": "anthropic.com",
    "url": "https://anthropic.com",
    "verified": true,
    "domain_verified": true,
    "official": true
  },
  "links": {
    "repository": "https://github.com/modelcontextprotocol/servers/tree/main/src/puppeteer",
    "homepage": "https://modelcontextprotocol.io",
    "documentation": "https://github.com/modelcontextprotocol/servers/blob/main/src/puppeteer/README.md"
  },
  "platforms": [
    "all"
  ],
  "capabilities": {
    "tools": true,
    "resources": true,
    "prompts": false
  },
  "badges": [
    "official"
  ],
  "hosting_type": "local",
  "license": "MIT",
  "license_url": "https://github.com/modelcontextprotocol/servers/blob/main/LICENSE",
  "installation": {
    "difficulty": "moderate",
    "prerequisites": [
      "Node.js 18+",
      "Chromium (auto-downloaded by Puppeteer)"
    ],
    "estimated_time": "5 minutes"
  }
}
