{
  "id": "com.anthropic.sqlite",
  "name": "SQLite",
  "alias": "sqlite",
  "description": "Interact with SQLite databases for querying, schema inspection, and data analysis. Supports running SQL queries against local SQLite database files with safe, controlled access.",
  "icon": "üóÉÔ∏è",
  "schema_version": "2.1",
  "transport": {
    "type": "stdio",
    "command": "npx",
    "args": [
      "-y",
      "@modelcontextprotocol/server-sqlite",
      "${SQLITE_DB_PATH}"
    ],
    "metadata": {
      "inputs": [
        {
          "id": "SQLITE_DB_PATH",
          "label": "SQLite Database Path",
          "type": "text",
          "required": true,
          "secret": false,
          "description": "Absolute path to the SQLite database file. The file will be created if it does not exist.",
          "placeholder": "/path/to/database.db"
        }
      ]
    }
  },
  "auth": {
    "type": "none",
    "instructions": "No authentication required. Simply provide the path to the SQLite database file."
  },
  "categories": [
    "database",
    "developer-tools"
  ],
  "tags": [
    "sqlite",
    "database",
    "sql",
    "queries",
    "local-database",
    "embedded",
    "data-analysis"
  ],
  "publisher": {
    "name": "Anthropic",
    "domain": "anthropic.com",
    "url": "https://anthropic.com",
    "verified": true,
    "domain_verified": true,
    "official": true
  },
  "links": {
    "repository": "https://github.com/modelcontextprotocol/servers/tree/main/src/sqlite",
    "homepage": "https://modelcontextprotocol.io",
    "documentation": "https://github.com/modelcontextprotocol/servers/blob/main/src/sqlite/README.md"
  },
  "platforms": [
    "all"
  ],
  "capabilities": {
    "tools": true,
    "resources": true,
    "prompts": false
  },
  "badges": [
    "official"
  ],
  "hosting_type": "local",
  "license": "MIT",
  "license_url": "https://github.com/modelcontextprotocol/servers/blob/main/LICENSE",
  "installation": {
    "difficulty": "easy",
    "prerequisites": [
      "Node.js 18+"
    ],
    "estimated_time": "2 minutes"
  }
}
