{
  "id": "com.anthropic.sequential-thinking",
  "name": "Sequential Thinking",
  "alias": "seqthink",
  "description": "A thinking tool that enables dynamic and reflective problem-solving through sequential thought steps. Supports branching, revision, and adjustment of reasoning chains for complex multi-step analysis and decision-making.",
  "icon": "ðŸ’­",
  "schema_version": "2.1",
  "transport": {
    "type": "stdio",
    "command": "npx",
    "args": [
      "-y",
      "@modelcontextprotocol/server-sequential-thinking"
    ],
    "metadata": {
      "inputs": []
    }
  },
  "auth": {
    "type": "none",
    "instructions": "No authentication required."
  },
  "categories": [
    "ai-ml",
    "developer-tools"
  ],
  "tags": [
    "thinking",
    "reasoning",
    "problem-solving",
    "analysis",
    "chain-of-thought",
    "planning",
    "decision-making"
  ],
  "publisher": {
    "name": "Anthropic",
    "domain": "anthropic.com",
    "url": "https://anthropic.com",
    "verified": true,
    "domain_verified": true,
    "official": true
  },
  "links": {
    "repository": "https://github.com/modelcontextprotocol/servers/tree/main/src/sequentialthinking",
    "homepage": "https://modelcontextprotocol.io",
    "documentation": "https://github.com/modelcontextprotocol/servers/blob/main/src/sequentialthinking/README.md"
  },
  "platforms": [
    "all"
  ],
  "capabilities": {
    "tools": true,
    "resources": false,
    "prompts": false
  },
  "badges": [
    "official"
  ],
  "hosting_type": "local",
  "license": "MIT",
  "license_url": "https://github.com/modelcontextprotocol/servers/blob/main/LICENSE",
  "installation": {
    "difficulty": "easy",
    "prerequisites": [
      "Node.js 18+"
    ],
    "estimated_time": "2 minutes"
  }
}
