{
  "id": "community.git",
  "name": "Git",
  "alias": "git",
  "description": "Perform Git version control operations including repository management, commits, branches, diffs, and log inspection. Provides tools for reading and manipulating Git repositories programmatically through MCP.",
  "icon": "ðŸ”€",
  "schema_version": "2.1",
  "transport": {
    "type": "stdio",
    "command": "uvx",
    "args": [
      "mcp-server-git"
    ],
    "metadata": {
      "inputs": [
        {
          "id": "GIT_REPOSITORY_PATH",
          "label": "Repository Path",
          "type": "text",
          "required": false,
          "secret": false,
          "description": "Default Git repository path to operate on. If not set, the server can work with any repository path provided per-request.",
          "placeholder": "/path/to/your/repo"
        }
      ]
    }
  },
  "auth": {
    "type": "none",
    "instructions": "No authentication required. Git credentials should be configured separately in your system's Git configuration for remote operations."
  },
  "categories": [
    "version-control",
    "developer-tools"
  ],
  "tags": [
    "git",
    "version-control",
    "repositories",
    "commits",
    "branches",
    "diff",
    "log",
    "vcs"
  ],
  "publisher": {
    "name": "Anthropic",
    "domain": "anthropic.com",
    "url": "https://anthropic.com",
    "verified": true,
    "domain_verified": true,
    "official": true
  },
  "links": {
    "repository": "https://github.com/modelcontextprotocol/servers/tree/main/src/git",
    "homepage": "https://modelcontextprotocol.io",
    "documentation": "https://github.com/modelcontextprotocol/servers/blob/main/src/git/README.md"
  },
  "platforms": [
    "all"
  ],
  "capabilities": {
    "tools": true,
    "resources": false,
    "prompts": false
  },
  "badges": [
    "official"
  ],
  "hosting_type": "local",
  "license": "MIT",
  "license_url": "https://github.com/modelcontextprotocol/servers/blob/main/LICENSE",
  "installation": {
    "difficulty": "easy",
    "prerequisites": [
      "Python 3.9+",
      "Git",
      "uv (Python package manager)"
    ],
    "estimated_time": "5 minutes"
  }
}
