{
  "id": "com.notion.mcp",
  "name": "Notion",
  "alias": "notion",
  "description": "Connect to Notion workspaces to search pages, read content, create and update pages, and manage databases. Enables AI-powered interaction with your Notion knowledge base and project documentation.",
  "icon": "üìù",
  "schema_version": "2.1",
  "transport": {
    "type": "stdio",
    "command": "npx",
    "args": [
      "-y",
      "@notionhq/notion-mcp-server"
    ],
    "env": {
      "OPENAPI_MCP_HEADERS": "{\"Authorization\": \"Bearer ${NOTION_API_KEY}\", \"Notion-Version\": \"2022-06-28\"}"
    },
    "metadata": {
      "inputs": [
        {
          "id": "NOTION_API_KEY",
          "label": "Notion API Key",
          "type": "password",
          "required": true,
          "secret": true,
          "description": "Notion internal integration token. Create an integration in Notion's developer portal and share relevant pages/databases with it.",
          "placeholder": "ntn_xxxxxxxxxxxxxxxxxxxxxxxxxxxxxxxxxxxxxxxxxxxx",
          "obtain": {
            "url": "https://www.notion.so/my-integrations",
            "instructions": "Go to https://www.notion.so/my-integrations, click 'New integration', give it a name, select your workspace, and copy the Internal Integration Token. Then share relevant Notion pages with your integration.",
            "button_label": "Create Notion Integration"
          }
        }
      ]
    }
  },
  "auth": {
    "type": "api_key",
    "instructions": "Requires a Notion Internal Integration Token. Create one at https://www.notion.so/my-integrations. Remember to share relevant pages and databases with the integration."
  },
  "categories": [
    "productivity",
    "documentation"
  ],
  "tags": [
    "notion",
    "notes",
    "wiki",
    "documentation",
    "pages",
    "databases",
    "knowledge-base",
    "workspace"
  ],
  "publisher": {
    "name": "Notion",
    "domain": "notion.so",
    "url": "https://notion.so",
    "verified": true,
    "domain_verified": true,
    "official": true
  },
  "links": {
    "repository": "https://github.com/makenotion/notion-mcp-server",
    "homepage": "https://notion.so",
    "documentation": "https://github.com/makenotion/notion-mcp-server/blob/main/README.md"
  },
  "platforms": [
    "all"
  ],
  "capabilities": {
    "tools": true,
    "resources": false,
    "prompts": false
  },
  "badges": [
    "official"
  ],
  "hosting_type": "local",
  "license": "MIT",
  "installation": {
    "difficulty": "moderate",
    "prerequisites": [
      "Node.js 18+",
      "Notion account with integration access"
    ],
    "estimated_time": "10 minutes"
  }
}
