{
  "id": "com.anthropic.aws-kb",
  "name": "AWS Knowledge Base Retrieval",
  "alias": "aws",
  "description": "Retrieve information from AWS Knowledge Bases using Amazon Bedrock Agent Runtime. Query knowledge bases backed by various data sources for retrieval-augmented generation (RAG) workflows with AWS services.",
  "icon": "ðŸ”¶",
  "schema_version": "2.1",
  "transport": {
    "type": "stdio",
    "command": "npx",
    "args": [
      "-y",
      "@modelcontextprotocol/server-aws-kb-retrieval"
    ],
    "env": {
      "AWS_ACCESS_KEY_ID": "${AWS_ACCESS_KEY_ID}",
      "AWS_SECRET_ACCESS_KEY": "${AWS_SECRET_ACCESS_KEY}",
      "AWS_REGION": "${AWS_REGION}"
    },
    "metadata": {
      "inputs": [
        {
          "id": "AWS_ACCESS_KEY_ID",
          "label": "AWS Access Key ID",
          "type": "password",
          "required": true,
          "secret": true,
          "description": "AWS Access Key ID for authenticating with AWS services. Must have permissions for Amazon Bedrock Agent Runtime.",
          "placeholder": "AKIAIOSFODNN7EXAMPLE",
          "obtain": {
            "url": "https://console.aws.amazon.com/iam/home#/security_credentials",
            "instructions": "Go to AWS Console > IAM > Users > Your User > Security credentials > Access keys. Create a new access key and note both the Access Key ID and Secret Access Key.",
            "button_label": "AWS IAM Console"
          }
        },
        {
          "id": "AWS_SECRET_ACCESS_KEY",
          "label": "AWS Secret Access Key",
          "type": "password",
          "required": true,
          "secret": true,
          "description": "AWS Secret Access Key paired with your Access Key ID.",
          "placeholder": "wJalrXUtnFEMI/K7MDENG/bPxRfiCYEXAMPLEKEY"
        },
        {
          "id": "AWS_REGION",
          "label": "AWS Region",
          "type": "text",
          "required": true,
          "secret": false,
          "description": "AWS region where your Knowledge Base is deployed (e.g., us-east-1, us-west-2).",
          "placeholder": "us-east-1"
        }
      ]
    }
  },
  "auth": {
    "type": "api_key",
    "instructions": "Requires AWS credentials (Access Key ID, Secret Access Key) with permissions for Amazon Bedrock Agent Runtime. Configure an IAM user with appropriate Bedrock policies."
  },
  "categories": [
    "cloud",
    "ai-ml"
  ],
  "tags": [
    "aws",
    "amazon",
    "bedrock",
    "knowledge-base",
    "rag",
    "retrieval",
    "cloud",
    "ai"
  ],
  "publisher": {
    "name": "Anthropic",
    "domain": "anthropic.com",
    "url": "https://anthropic.com",
    "verified": true,
    "domain_verified": true,
    "official": true
  },
  "links": {
    "repository": "https://github.com/modelcontextprotocol/servers/tree/main/src/aws-kb-retrieval-server",
    "homepage": "https://aws.amazon.com/bedrock/",
    "documentation": "https://github.com/modelcontextprotocol/servers/blob/main/src/aws-kb-retrieval-server/README.md"
  },
  "platforms": [
    "all"
  ],
  "capabilities": {
    "tools": true,
    "resources": false,
    "prompts": false,
    "read_only_mode": true
  },
  "badges": [
    "official"
  ],
  "hosting_type": "local",
  "license": "MIT",
  "license_url": "https://github.com/modelcontextprotocol/servers/blob/main/LICENSE",
  "installation": {
    "difficulty": "advanced",
    "prerequisites": [
      "Node.js 18+",
      "AWS account with Bedrock access",
      "Configured Knowledge Base in Amazon Bedrock"
    ],
    "estimated_time": "15 minutes"
  }
}
