{
  "id": "com.anthropic.slack",
  "name": "Slack",
  "alias": "slack",
  "description": "Integrate with Slack workspaces to send messages, manage channels, read conversation history, and interact with users. Enables AI-powered Slack workflows and channel management.",
  "icon": "ðŸ’¬",
  "schema_version": "2.1",
  "transport": {
    "type": "stdio",
    "command": "npx",
    "args": [
      "-y",
      "@modelcontextprotocol/server-slack"
    ],
    "env": {
      "SLACK_BOT_TOKEN": "${SLACK_BOT_TOKEN}",
      "SLACK_TEAM_ID": "${SLACK_TEAM_ID}"
    },
    "metadata": {
      "inputs": [
        {
          "id": "SLACK_BOT_TOKEN",
          "label": "Slack Bot Token",
          "type": "password",
          "required": true,
          "secret": true,
          "description": "Slack Bot User OAuth Token starting with xoxb-. Requires channels:history, channels:read, chat:write, users:read, and reactions:write scopes.",
          "placeholder": "xoxb-xxxxxxxxxxxx-xxxxxxxxxxxx-xxxxxxxxxxxxxxxxxxxxxxxx",
          "obtain": {
            "url": "https://api.slack.com/apps",
            "instructions": "Create a new Slack app at api.slack.com/apps, add the required Bot Token scopes (channels:history, channels:read, chat:write, users:read, reactions:write), install to your workspace, and copy the Bot User OAuth Token.",
            "button_label": "Create Slack App"
          }
        },
        {
          "id": "SLACK_TEAM_ID",
          "label": "Slack Team ID",
          "type": "text",
          "required": true,
          "secret": false,
          "description": "Your Slack workspace Team ID. Found in workspace settings or by visiting your Slack workspace URL.",
          "placeholder": "T0123456789",
          "obtain": {
            "url": "https://slack.com/help/articles/221769328-Locate-your-Slack-URL-or-ID",
            "instructions": "Open Slack, click your workspace name in the top left, select 'Settings & administration' > 'Workspace settings'. Your Team ID is displayed on this page.",
            "button_label": "Find Team ID"
          }
        }
      ]
    }
  },
  "auth": {
    "type": "api_key",
    "instructions": "Requires a Slack Bot Token (xoxb-) and Team ID. Create a Slack app at https://api.slack.com/apps with the necessary scopes."
  },
  "categories": [
    "communication",
    "productivity"
  ],
  "tags": [
    "slack",
    "messaging",
    "chat",
    "channels",
    "workspace",
    "team-communication",
    "notifications"
  ],
  "publisher": {
    "name": "Anthropic",
    "domain": "anthropic.com",
    "url": "https://anthropic.com",
    "verified": true,
    "domain_verified": true,
    "official": true
  },
  "links": {
    "repository": "https://github.com/modelcontextprotocol/servers/tree/main/src/slack",
    "homepage": "https://modelcontextprotocol.io",
    "documentation": "https://github.com/modelcontextprotocol/servers/blob/main/src/slack/README.md"
  },
  "platforms": [
    "all"
  ],
  "capabilities": {
    "tools": true,
    "resources": false,
    "prompts": false
  },
  "badges": [
    "official"
  ],
  "hosting_type": "local",
  "license": "MIT",
  "license_url": "https://github.com/modelcontextprotocol/servers/blob/main/LICENSE",
  "installation": {
    "difficulty": "moderate",
    "prerequisites": [
      "Node.js 18+",
      "Slack workspace admin access"
    ],
    "estimated_time": "10 minutes"
  }
}
