{
  "id": "com.anthropic.memory",
  "name": "Memory (Knowledge Graph)",
  "alias": "memory",
  "description": "Persistent knowledge graph memory system that stores entities, relationships, and observations in a local JSON file. Enables AI assistants to maintain long-term memory across conversations with structured knowledge representation.",
  "icon": "ðŸ§ ",
  "schema_version": "2.1",
  "transport": {
    "type": "stdio",
    "command": "npx",
    "args": [
      "-y",
      "@modelcontextprotocol/server-memory"
    ],
    "metadata": {
      "inputs": []
    }
  },
  "auth": {
    "type": "none",
    "instructions": "No authentication required. Memory is stored locally in a JSON file."
  },
  "categories": [
    "ai-ml",
    "productivity"
  ],
  "tags": [
    "memory",
    "knowledge-graph",
    "persistence",
    "entities",
    "relationships",
    "long-term-memory",
    "context"
  ],
  "publisher": {
    "name": "Anthropic",
    "domain": "anthropic.com",
    "url": "https://anthropic.com",
    "verified": true,
    "domain_verified": true,
    "official": true
  },
  "links": {
    "repository": "https://github.com/modelcontextprotocol/servers/tree/main/src/memory",
    "homepage": "https://modelcontextprotocol.io",
    "documentation": "https://github.com/modelcontextprotocol/servers/blob/main/src/memory/README.md"
  },
  "platforms": [
    "all"
  ],
  "capabilities": {
    "tools": true,
    "resources": false,
    "prompts": false
  },
  "badges": [
    "official"
  ],
  "hosting_type": "local",
  "license": "MIT",
  "license_url": "https://github.com/modelcontextprotocol/servers/blob/main/LICENSE",
  "installation": {
    "difficulty": "easy",
    "prerequisites": [
      "Node.js 18+"
    ],
    "estimated_time": "2 minutes"
  }
}
