{
  "id": "com.anthropic.gdrive",
  "name": "Google Drive",
  "alias": "gdrive",
  "description": "Access and search Google Drive files, read document contents, and manage files. Supports Google Docs, Sheets, and other Drive file types with OAuth 2.0 authentication for secure access.",
  "icon": "ðŸ“‚",
  "schema_version": "2.1",
  "transport": {
    "type": "stdio",
    "command": "npx",
    "args": [
      "-y",
      "@modelcontextprotocol/server-gdrive"
    ],
    "metadata": {
      "inputs": [
        {
          "id": "GDRIVE_CLIENT_ID",
          "label": "Google OAuth Client ID",
          "type": "text",
          "required": true,
          "secret": false,
          "description": "OAuth 2.0 Client ID from Google Cloud Console for authenticating with Google Drive API.",
          "placeholder": "xxxxxxxxxxxx-xxxxxxxxxxxxxxxxxxxxxxxxxxxxxxxx.apps.googleusercontent.com",
          "obtain": {
            "url": "https://console.cloud.google.com/apis/credentials",
            "instructions": "Go to Google Cloud Console > APIs & Services > Credentials. Create an OAuth 2.0 Client ID for a Desktop application. Enable the Google Drive API in your project.",
            "button_label": "Google Cloud Console"
          }
        },
        {
          "id": "GDRIVE_CLIENT_SECRET",
          "label": "Google OAuth Client Secret",
          "type": "password",
          "required": true,
          "secret": true,
          "description": "OAuth 2.0 Client Secret from Google Cloud Console.",
          "placeholder": "GOCSPX-xxxxxxxxxxxxxxxxxxxxxxxx"
        }
      ]
    }
  },
  "auth": {
    "type": "oauth",
    "instructions": "Requires Google OAuth 2.0 credentials. Create a project in Google Cloud Console, enable the Google Drive API, and create OAuth 2.0 Desktop credentials. The server will guide you through the OAuth flow on first use."
  },
  "categories": [
    "productivity",
    "file-system",
    "cloud"
  ],
  "tags": [
    "google-drive",
    "cloud-storage",
    "documents",
    "sheets",
    "oauth",
    "file-management",
    "google"
  ],
  "publisher": {
    "name": "Anthropic",
    "domain": "anthropic.com",
    "url": "https://anthropic.com",
    "verified": true,
    "domain_verified": true,
    "official": true
  },
  "links": {
    "repository": "https://github.com/modelcontextprotocol/servers/tree/main/src/gdrive",
    "homepage": "https://modelcontextprotocol.io",
    "documentation": "https://github.com/modelcontextprotocol/servers/blob/main/src/gdrive/README.md"
  },
  "platforms": [
    "all"
  ],
  "capabilities": {
    "tools": true,
    "resources": true,
    "prompts": false,
    "read_only_mode": true
  },
  "badges": [
    "official"
  ],
  "hosting_type": "local",
  "license": "MIT",
  "license_url": "https://github.com/modelcontextprotocol/servers/blob/main/LICENSE",
  "installation": {
    "difficulty": "moderate",
    "prerequisites": [
      "Node.js 18+",
      "Google Cloud project with Drive API enabled"
    ],
    "estimated_time": "15 minutes"
  }
}
