{
  "id": "com.cloudflare.mcp",
  "name": "Cloudflare",
  "alias": "cf",
  "description": "Manage Cloudflare resources including Workers, KV namespaces, D1 databases, and R2 storage buckets. Deploy serverless functions, manage edge configuration, and interact with Cloudflare's developer platform.",
  "icon": "☁️",
  "schema_version": "2.1",
  "transport": {
    "type": "stdio",
    "command": "npx",
    "args": [
      "-y",
      "@cloudflare/mcp-server-cloudflare"
    ],
    "env": {
      "CLOUDFLARE_API_TOKEN": "${CLOUDFLARE_API_TOKEN}"
    },
    "metadata": {
      "inputs": [
        {
          "id": "CLOUDFLARE_API_TOKEN",
          "label": "Cloudflare API Token",
          "type": "password",
          "required": true,
          "secret": true,
          "description": "Cloudflare API token with permissions for Workers, KV, D1, and R2 management. Create a custom token with the appropriate permissions for your use case.",
          "placeholder": "xxxxxxxxxxxxxxxxxxxxxxxxxxxxxxxxxxxxxxxx",
          "obtain": {
            "url": "https://dash.cloudflare.com/profile/api-tokens",
            "instructions": "Go to Cloudflare Dashboard > My Profile > API Tokens > Create Token. Use a custom template and grant permissions for Workers Scripts, Workers KV Storage, D1, and R2 as needed.",
            "button_label": "Create Cloudflare Token"
          }
        },
        {
          "id": "CLOUDFLARE_ACCOUNT_ID",
          "label": "Cloudflare Account ID",
          "type": "text",
          "required": false,
          "secret": false,
          "description": "Your Cloudflare Account ID. Found on the right sidebar of the Cloudflare dashboard overview page.",
          "placeholder": "xxxxxxxxxxxxxxxxxxxxxxxxxxxxxxxx",
          "obtain": {
            "url": "https://dash.cloudflare.com/",
            "instructions": "Log into the Cloudflare Dashboard, select your domain, and find the Account ID on the right sidebar of the Overview page.",
            "button_label": "Find Account ID"
          }
        }
      ]
    }
  },
  "auth": {
    "type": "api_key",
    "instructions": "Requires a Cloudflare API Token. Create one at https://dash.cloudflare.com/profile/api-tokens with appropriate permissions for your resources."
  },
  "categories": [
    "cloud",
    "developer-tools"
  ],
  "tags": [
    "cloudflare",
    "workers",
    "edge-computing",
    "kv",
    "d1",
    "r2",
    "serverless",
    "cdn"
  ],
  "publisher": {
    "name": "Cloudflare",
    "domain": "cloudflare.com",
    "url": "https://cloudflare.com",
    "verified": true,
    "domain_verified": true,
    "official": true
  },
  "links": {
    "repository": "https://github.com/cloudflare/mcp-server-cloudflare",
    "homepage": "https://developers.cloudflare.com",
    "documentation": "https://github.com/cloudflare/mcp-server-cloudflare/blob/main/README.md"
  },
  "platforms": [
    "all"
  ],
  "capabilities": {
    "tools": true,
    "resources": false,
    "prompts": false
  },
  "badges": [
    "official"
  ],
  "hosting_type": "local",
  "license": "MIT",
  "license_url": "https://github.com/cloudflare/mcp-server-cloudflare/blob/main/LICENSE",
  "installation": {
    "difficulty": "moderate",
    "prerequisites": [
      "Node.js 18+",
      "Cloudflare account"
    ],
    "estimated_time": "10 minutes"
  }
}
