{
  "id": "com.anthropic.docker",
  "name": "Docker",
  "alias": "docker",
  "description": "Manage Docker containers, images, volumes, and networks through MCP. List running containers, inspect configurations, view logs, manage images, and control container lifecycle operations.",
  "icon": "üê≥",
  "schema_version": "2.1",
  "transport": {
    "type": "stdio",
    "command": "npx",
    "args": [
      "-y",
      "@modelcontextprotocol/server-docker"
    ],
    "metadata": {
      "inputs": []
    }
  },
  "auth": {
    "type": "none",
    "instructions": "No authentication required. The server communicates with the local Docker daemon. Ensure Docker Desktop or Docker Engine is running."
  },
  "categories": [
    "developer-tools",
    "cloud"
  ],
  "tags": [
    "docker",
    "containers",
    "images",
    "devops",
    "orchestration",
    "deployment",
    "virtualization"
  ],
  "publisher": {
    "name": "Anthropic",
    "domain": "anthropic.com",
    "url": "https://anthropic.com",
    "verified": true,
    "domain_verified": true,
    "official": true
  },
  "links": {
    "repository": "https://github.com/modelcontextprotocol/servers/tree/main/src/docker",
    "homepage": "https://modelcontextprotocol.io",
    "documentation": "https://github.com/modelcontextprotocol/servers/blob/main/src/docker/README.md"
  },
  "platforms": [
    "all"
  ],
  "capabilities": {
    "tools": true,
    "resources": true,
    "prompts": false
  },
  "badges": [
    "official"
  ],
  "hosting_type": "local",
  "license": "MIT",
  "license_url": "https://github.com/modelcontextprotocol/servers/blob/main/LICENSE",
  "installation": {
    "difficulty": "moderate",
    "prerequisites": [
      "Node.js 18+",
      "Docker Desktop or Docker Engine"
    ],
    "estimated_time": "5 minutes"
  }
}
