{
  "id": "com.anthropic.google-maps",
  "name": "Google Maps",
  "alias": "gmaps",
  "description": "Access Google Maps Platform APIs for geocoding, directions, place search, elevation data, and distance calculations. Enables location-aware AI interactions with comprehensive mapping data.",
  "icon": "ðŸ—ºï¸",
  "schema_version": "2.1",
  "transport": {
    "type": "stdio",
    "command": "npx",
    "args": [
      "-y",
      "@modelcontextprotocol/server-google-maps"
    ],
    "env": {
      "GOOGLE_MAPS_API_KEY": "${GOOGLE_MAPS_API_KEY}"
    },
    "metadata": {
      "inputs": [
        {
          "id": "GOOGLE_MAPS_API_KEY",
          "label": "Google Maps API Key",
          "type": "password",
          "required": true,
          "secret": true,
          "description": "Google Maps Platform API key with access to Geocoding, Directions, Places, Elevation, and Distance Matrix APIs.",
          "placeholder": "AIzaSyXXXXXXXXXXXXXXXXXXXXXXXXXXXXXXXXX",
          "obtain": {
            "url": "https://console.cloud.google.com/google/maps-apis/credentials",
            "instructions": "Go to Google Cloud Console > APIs & Services > Credentials. Create an API key and enable the required Maps APIs (Geocoding, Directions, Places, Elevation, Distance Matrix).",
            "button_label": "Get Maps API Key"
          }
        }
      ]
    }
  },
  "auth": {
    "type": "api_key",
    "instructions": "Requires a Google Maps Platform API key. Create one in the Google Cloud Console and enable the necessary Maps APIs."
  },
  "categories": [
    "search",
    "productivity"
  ],
  "tags": [
    "google-maps",
    "geocoding",
    "directions",
    "places",
    "maps",
    "location",
    "navigation"
  ],
  "publisher": {
    "name": "Anthropic",
    "domain": "anthropic.com",
    "url": "https://anthropic.com",
    "verified": true,
    "domain_verified": true,
    "official": true
  },
  "links": {
    "repository": "https://github.com/modelcontextprotocol/servers/tree/main/src/google-maps",
    "homepage": "https://modelcontextprotocol.io",
    "documentation": "https://github.com/modelcontextprotocol/servers/blob/main/src/google-maps/README.md"
  },
  "platforms": [
    "all"
  ],
  "capabilities": {
    "tools": true,
    "resources": false,
    "prompts": false,
    "read_only_mode": true
  },
  "badges": [
    "official"
  ],
  "hosting_type": "local",
  "license": "MIT",
  "license_url": "https://github.com/modelcontextprotocol/servers/blob/main/LICENSE",
  "installation": {
    "difficulty": "easy",
    "prerequisites": [
      "Node.js 18+"
    ],
    "estimated_time": "5 minutes"
  }
}
